{
  "schema_version": 2,
  "id": "alignment.mfa.models.en",
  "version": "1.0.0",
  "name": "MFA English alignment models",
  "description": "English Montreal Forced Aligner model assets for Atonim local forced alignment.",
  "languages": [
    "en"
  ],
  "requires": [],
  "compatibility": {
    "platform": "macos",
    "architecture": "arm64",
    "min_app_version": "1.0.0",
    "max_app_version": "1.999.999"
  },
  "artifact": {
    "format": "tar.gz",
    "url": "https://github.com/Ruckola/atonim-dependencies/releases/download/mfa-models-en-v1.0.0/atonim-mfa-models-en-1.0.0.tar.gz",
    "sha256": "85523d534a19141f616d7df36f14496603b0aa0f250e98668407bc7fa89b72aa",
    "size_bytes": 92509591,
    "extracted_size_bytes": 93249006
  },
  "exports": {
    "acoustic_model": {
      "path": "models/acoustic.zip",
      "type": "file",
      "sha256": "2c08bd4f82c3943dd57ac09aeac99dbce17a1e1bfe9fd932c8d95cd13d971068"
    },
    "dictionary": {
      "path": "models/dictionary.dict",
      "type": "file",
      "sha256": "975bf9c7791535c5aec57995e0bd2b77eb7ca364d1d974c2134e07bb0f16b079"
    }
  },
  "health": [],
  "redistribution": {
    "cleared": true
  }
}
